create-animal-mod/data.json

{
  "modName": "NewCow",
  "modId": "1000",
  "authorName": "Sad_Tech",
  "codeName": "new_cow",
  "description": "Add a new cow.",
  "translations": {
    "en": {
      "name": "New Cow",
      "description": "Add a new cow."
    },
    "zh": {
      "name": "阿尔维斯牛",
      "description": "添加来自阿尔维斯庇护所的红安格斯牛“维尼·哞”。"
    },
    "zh_HK": {
      "name": "阿爾維斯牛",
      "description": "添加來自阿爾維斯庇護所的紅安格斯牛「維尼·哞」。"
    }
  },
  "price": 2000.0,
  "adult_price": [12000.0, 24000.0, 35000.0, 40000.0, 48000.0],
  "child_price": [100.0, 2000.0, 4000.0, 8000.0, 12000.0],
  "adult_time": [300, 450, 1500, 3000, 6000],
  "drop_time": [300, 900, 1800, 2700, 3600],
  "second_coin": [166.73, 200.08, 277.88, 625.25, 1667.33],
  "poop_time": 800,
  "max_hunger": 100.0,
  "hungry_speed": 1.0,
  "poop_endure": 15,
  "max_move_speed": 40,
  "min_move_speed": 30,
  "variations_no": 1,
  "is_fish": false,
  "sprite": {
    "width": 50,
    "height": 50
  },
  "animations": {
    "idle_0": {
      "fps": 5,
      "startFrame": [0, 0],
      "endFrame": [7, 0]
    },
    "idle_1_pre": {
      "fps": 10,
      "startFrame": [0, 1],
      "endFrame": [2, 1]
    },
    "idle_1_loop": {
      "fps": 10,
      "frames": [[4, 1], [5, 1], [6, 1], [0, 2]]
    },
    "idle_1_end": {
      "fps": 10,
      "startFrame": [1, 2],
      "endFrame": [2, 2]
    },
    "sleep_pre": {
      "fps": 6.666666666666667,
      "startFrame": [0, 3],
      "endFrame": [5, 3]
    },
    "sleep_loop": {
      "fps": 6.666666666666667,
      "startFrame": [0, 4],
      "endFrame": [5, 4]
    },
    "sleep_end": {
      "fps": 6.666666666666667,
      "startFrame": [0, 5],
      "endFrame": [5, 5]
    },
    "move": {
      "fps": 6.666666666666667,
      "startFrame": [0, 6],
      "endFrame": [5, 6]
    },
    "interact_0": {
      "fps": 6.666666666666667,
      "startFrame": [0, 7],
      "endFrame": [7, 7]
    },
    "eat": {
      "fps": 6.666666666666667,
      "frames": [[0, 8], [1, 8], [2, 8], [3, 8], [4, 8], [5, 8], [0, 9], [1, 9], [2, 9], [0, 9], [1, 9], [2, 9], [0, 9], [1, 9], [2, 9], [4, 9], [5, 9], [6, 9], [7, 9]]
    }
  },
  "shop_idle_animation": {
    "fps": 5,
    "startFrame": [0, 0],
    "endFrame": [7, 0]
  }
}

docs/templates/create-animal-mod.md

### Update data.json

**Animal data:**
- **adult_price** - selling prices for adult animals - an array/list of 5 number values, one price for each star/quality rating, ie: `[12000.0, 24000.0, 35000.0, 40000.0, 48000.0]`
- **child_price** - selling prices for child animals - an array/list of 5 number values, one price for each star/quality rating, ie: `[100.0, 2000.0, 4000.0, 8000.0, 12000.0]`
- **adult_time** - time required for the animal to grow to adulthood in seconds - an array/list of 5 number values, one number for each star/quality rating, ie: `[300, 450, 1500, 3000, 6000]`
- **drop_time** - time the animal can store earnings in seconds (until money is dropped to the ground) - an array/list of 5 number values, one number for each star/quality rating, ie: `[300, 900, 1800, 2700, 3600]`
- **second_coin** - earning rate of the animal in seconds - an array/list of 5 number values, one number for each star/quality rating, ie: `[166.73, 200.08, 277.88, 625.25, 1667.33]`
- **poop_time** - how long it takes for the animal to drop poop in seconds, ie: `800`
- **max_hunger** - maximum hunger value of the animal, ie: `100.0`
- **hungry_speed** - amount hunger decreases every 60 seconds, ie: `1.0`
- **poop_endure** - number of poops the animal can tolerate in the environment (exceeding this number causes the animal to lose health), ie: `15`
- **max_move_speed** - maximum movement speed randomly generated when a new animal is created, ie: `40`
- **min_move_speed** - minimum movement speed randomly generated when a new animal is created, ie: `30`
- **variations_no** - how many colour variations you have created assets for, ie: `1`
- **is_fish** - whether the animal is a fish or not, ie: `true` or `false`